<?xml version="1.0" encoding="UTF-8" ?>
<papers xmlns:xsi="http://www.w3.org/2001/XMLSchema-instance"
        xsi:noNamespaceSchemaLocation="papers.xsd">

    <newspaper id="P1" glossy="нет глянца(это газета)">
        <title>Гродненская правда</title>
        <monthly>false</monthly>
        <color>false</color>
        <pages>21</pages>
        <date>2002-05-30T09:00:00</date>
        <subscription-index>5</subscription-index>
    </newspaper>

    <booklet id="P2" glossy="глянец на буклете">
        <title>остров чистоты</title>
        <monthly>false</monthly>
        <color>false</color>
        <pages>34</pages>
        <date>2002-05-30T09:00:00</date>
    </booklet>

    <magazine id="P3" glossy="глянец на журнале">
        <title>остров чистоты</title>
        <monthly>false</monthly>
        <color>false</color>
        <pages>34</pages>
        <date>2002-05-30T09:00:00</date>
        <subscription-index>56</subscription-index>
    </magazine>

</papers>